the battery is replaceable ( a real plus ) and there is a leather case ( another real plus ) .	1
well  this apex dvd player turned out great !	1
my only significant complaint is sound quality .	0
i bought it for my trip to beunos aires  and also used it at the iguazu falls  and could not have asked for more perfect performance !	1
zennx 's replaceable battery was the deciding factor in my purchase of zennx over ipod .	1
the dvd door would scratch the top of the disc every time it closed .	0
we have had this product for over a month and yesterday it stopped working .	0
to address two previous somewhat negative reviews : ( 1 ) yes  the lens barrel does obstruct part of the lower left corner in the lens viewfinder  however  the lcd viewfinder is rather stunning and i find myself rarely using the lens viewfinder .	0
i checked out the amazon reviews and i 'm pleased to say mine worked  works  fine right out of the box .	1
whether you are a novice or an expert  its ease of use and functionality goes together .	1
i bought my canon g3 about a month ago and i have to say i am very satisfied .	1
it played only one out of three dvd 's without problems  the other two being afflicted by a number of glitches .	0
i gave the zen 5 stars because it 's excellent for the class that it is in and it 's not really appropriate to rate it based on players in a different class .	1
the only two minor issues i have with the camera are the lens cap ( it is not very snug and can come off too easily ) and the lens itself ( it partially obstructs the view through the viewfinder but not views through the lcd ) .	0
it would have been much nicer if it had a window so you could see the screen  and if the button did n't cover up the ac jack .	0
it seems to be a little slow when identifying a new disc that 's inserted - maybe 10 seconds of wait .	0
mine was 2 weeks old and i chucked it in the trash  where it belongs .	0
the interface used could be better designed .	0
the navigation is nice enough  but scrolling and searching through thousands of tracks  hundreds of albums or artists  or even dozens of genres is not conducive to save driving .	0
the extended zoom range and faster lense put it at the top of it 's class .	1
* protective case completely useless as is since it obscures display window .	0
the little jog dial seems weak and quirky and i hope i do n't figure out a way to break it .	0
with a quick spin of the dial you can select shutter priority ( for high speed subjects )  aperture priority ( for focal length ) or full program mode where the camera selects both for ideal photo quality .	1
in any case  navigation by artist / album is ok however i miss an ability to navigate by folders .	0
3 ) folders cannot be created for the audio files .	0
i love my new nomad  its great !	1
i purchased the nomad jukebox zen xtra 40gb and it is fantastic !	1
the camera 's a work of art / science -- that 's understood .	1
sure it had all the features  but when i tried to shoot a girl 's basketball game it just wan't up to the task .	0
i love having the option to manually control the f-stop  shutter speed and even focus .	1
i had to return the remote on this product because it appeared to be defective .	0
otherwise  this player is awesome !	1
one little minor flaw with this camera is that the lens is visible in the viewfinder  but does not detract from the image at all .	0
for the money apex machines have good features .	1
the unit seems to play all formats that i have put in it ( jpeg  kodak pic 's and dvd-r ) i have read other reviews and some good and soom not so good  but my feeling at this time is " two thumbs up " !	1
even with these shortcomings  i still think it is the best digital camera available under $ 1200 .	1
and the case  how did this ever make it out of quality control .	0
i did not managed to make creative nomad explorer to work .	0
the machine is very light and slim and fits nicely into my tv stand .	1
so far i have no complaints and i recommend this to anyone who wants quality over appearance  also anyone who wants a harddrive based mp3 player and wants to pay next to nothing .	1
otherwise  it is difficult to figure out and awkward .	0
this is my first digital camera and i could n't be happier .	1
and man ... i had to work to put my chinese songs on the player ... because i had the actual chinese names of the songs as the title ..	0
it is a very amazing product .	1
i looked into buying an inexpensive dvd player that had more than the standard set of features and this item seemed to be the best in that category .	1
it is a bit cumbersome  and i can 't get to the songs i want as quickly .	0
p.s the remote control does seem to get confused at times and doesnt respond but it may be just operator error ?	0
i 've tried the belkin fm transmitter unit with it  it worked well when i set it on top of a portable radio  but was awful trying to use in the car which is somewhat of a disappointment .	0
another good thing is that this camera seems to introduce much less noise in dark places than others i 've seen .	1
it surpasses my greatest expectations in a 4mp camera ..	1
great quality picture and features .	1
-- > you 'll be changing track information a lot because the cd database information utilized by the software is mediocre at best .	0
( i knew this before hand  and it is not that bad ) there is no tiff format .	0
difficult navigation - i wo n't necessarily say " difficult  " but i do n't enjoy the scrollwheel to navigate .	0
minor complaints : 1 ) even though the music is sorted via id3 tag on the player  the option to search for music contained in a folder is unavailable .	0
b ) the lens cover is surely loose  i already accidently finger-printed the len a few times  and au lens tigt and cause potential damage .	0
i just hooked it up and everything seemed to be going fine .	1
the remote is okay  but i am not a fan of remotes with tiny buttons .	0
yes there is a corner lens barrel distortion ( i do n't like it too but no harm done since i always use the camea lcd screen to see exactly what i 'm going to get ) in the viewfinder when you do n't zoom ( when you zoom the lens distortion goes away )  canon knows this and engineered it that way to minimize the parallax phenomenon  that is what lmost exactly ot the picture .	0
i have not played with all the features yet  but the camera is easy to use once you get used to it .	1
the face-plate  which pops out for the battery  pops open by itself every 10 minutes or so .	0
noiseless  lightweight and oh yeah .	1
while  there are flaws with the machine  the xtra gets five stars because of its affordability .	1
it has never worked .	0
best camera ever . from the image quality  color  function  i can say almost everything .	1
and it holds sooooo much music and audio files .	1
when i took outdoor photos with plenty of light and the objects were n't moving  the photos were awesome .	1
2 ) not very ergonomical - you 'll find even for a point-and-shoot lens )	0
nothing has broken on it  and it plays all the dvds i have .	1
there are a couple things i didnt like though but nothing serious : a little larger than other mp3s but still light  the software takes some time to get used to ( maybe 10-15 mins )  and this thing would definitely be destroyed with one fall .	0
first and foremost  it will take better pic 's than most film camera 's .	1
about 10 % of the time it can 't find the device when i attach it to my pc .	0
the photo quality is amazing and i know i 'm going to have fun with all the features .	1
i was willing to live with the larger size ( inconvenient on the road ) but the durability was a big zero .	0
the ad-1600 did n't work corectly from the start and the ad-1220 lasted about a week and a half before it started to act up .	0
my dad also has an apex tv and it was another great value for the money .	1
not counting the time i spent editing the songs ( i suppose i should 've done it anyway on my pc ) the transfer was pretty painless .	1
the only thing i did experience was a problem of the player freezing while playing  which i was able to clear by opening it up and blowing it out with " canned air . "	0
2 . battery life is over 4.5 hours  compared to about 2.5 hours for the g2 or the 2 hours for most nikons .	1
this is my first digital camera  and what a ' toy ' it is !	1
